{
  "stage": "M4",
  "assumptions": [
    "초기 2주간 크리에이티브 학습 기간을 별도로 둔다."
  ],
  "inputs_used": {
    "from_stage": "M3.handoff_payload",
    "target_region": "KR"
  },
  "artifacts": {
    "optimized_assets": {
      "tone_unification": "모든 소재의 첫 문장을 가치 제안형으로 통일",
      "compliance_fix": "비교 우월 암시 문구 삭제",
      "geo_refactor": "FAQ/광고 본문을 Answer-first 구조로 재작성"
    },
    "ab_test_plan": [
      {
        "test_id": "AB-H1",
        "hypothesis": "실사용 시나리오 헤드라인이 기능형 대비 CTR 개선",
        "success_metric": "CTR +10%",
        "stop_rule": "7일/95% 신뢰 미달 시 종료"
      },
      {
        "test_id": "AB-CTA2",
        "hypothesis": "체험 유도 CTA가 혜택형 대비 랜딩 전환 개선",
        "success_metric": "LP CVR +8%",
        "stop_rule": "샘플 20,000 도달 시 판정"
      }
    ],
    "geo_ready_modules": [
      "질문: 왜 폴드8인가? 답: 일상 멀티태스킹 효율을 높이는 폴더블 사용경험",
      "질문: 무엇이 달라지나? 답: 펼침 화면 기반의 작업 연속성과 가독성 향상"
    ]
  },
  "quality_notes": [
    "M2 voice 키워드 충돌 없음",
    "문화/규제 민감 표현 이상 없음"
  ],
  "next_stage_ready": true,
  "handoff_payload": {
    "approved_asset_pack": {
      "search": 8,
      "social": 10,
      "video": 4
    },
    "experiment_backlog": [
      "가격 메시지 노출 수준 조정",
      "비교형 랜딩 정보 구조 개선"
    ],
    "compliance_flags": []
  }
}
